{
  "schema_version": 0,
  "pipeline_version": "0.0.0",
  "units": "mm",
  "up": "+Y",
  "floor_polygon": [
    [
      -2259,
      -1866
    ],
    [
      2259,
      -1866
    ],
    [
      2259,
      1866
    ],
    [
      -2259,
      1866
    ]
  ],
  "ceiling_height_mm": 2651,
  "ceiling_observed": true,
  "walls": [
    {
      "id": "W1",
      "start": [
        -2259,
        -1866
      ],
      "end": [
        2259,
        -1866
      ],
      "thickness_mm": 100,
      "kind": "solid",
      "length_mm": 4517
    },
    {
      "id": "W2",
      "start": [
        2259,
        -1866
      ],
      "end": [
        2259,
        1866
      ],
      "thickness_mm": 100,
      "kind": "solid",
      "length_mm": 3732
    },
    {
      "id": "W3",
      "start": [
        2259,
        1866
      ],
      "end": [
        -2259,
        1866
      ],
      "thickness_mm": 100,
      "kind": "solid",
      "length_mm": 4517
    },
    {
      "id": "W4",
      "start": [
        -2259,
        1866
      ],
      "end": [
        -2259,
        -1866
      ],
      "thickness_mm": 100,
      "kind": "solid",
      "length_mm": 3732
    }
  ],
  "openings": [
    {
      "id": "O1",
      "wall_id": "W3",
      "type": "door",
      "offset_mm": 1290,
      "width_mm": 830,
      "sill_mm": 0,
      "height_mm": 2040,
      "swing": "unknown",
      "confidence": 0.9
    },
    {
      "id": "O2",
      "wall_id": "W1",
      "type": "window",
      "offset_mm": 1690,
      "width_mm": 1800,
      "sill_mm": 900,
      "height_mm": 1200,
      "swing": "unknown",
      "confidence": 0.85
    }
  ],
  "fixed_obstacles": [],
  "appearance": {
    "floor": {
      "color": "#efecea",
      "material": "oak"
    },
    "ceiling": {
      "color": "#f6f9fc",
      "material": "paint"
    },
    "tier": 0
  },
  "scale": {
    "factor": 1.0,
    "sources": [
      {
        "name": "fixture",
        "factor": 1.0,
        "weight": 1.0
      }
    ],
    "confidence": "high",
    "user_calibrated": true
  },
  "quality": {
    "coverage_pct": 96.0,
    "frames_used": 112,
    "warnings": []
  }
}
